{
  "$schema": "./wave_gate_matrix_v1.schema.json",
  "matrixId": "MKDDC-WAVE-GATE-MATRIX-V1",
  "schemaVersion": 1,
  "description": "Ma trận cổng bắt buộc theo từng Wave của Plan 59. Mỗi cổng ghi rõ MỨC BẰNG CHỨNG nó tạo ra. Cổng mức HOST chạy được ngay trên máy dev; cổng mức CI/TARGET/HIL cần tài nguyên ngoài và KHÔNG BAO GIỜ được runner cục bộ báo PASS.",
  "evidenceLevels": {
    "HOST": "Chạy trên máy dev. Chứng minh code/contract nhất quán. KHÔNG phải bằng chứng release.",
    "CI": "Chạy trên GitHub Actions với required checks. Cần tài khoản CI hoạt động.",
    "TARGET": "Chạy trên board thật (Forlinx/Foxlinx). Cần phần cứng.",
    "HIL": "Chạy với instrument đo I/O vật lý. Cần phần cứng và thiết bị đo."
  },
  "gates": [
    {"id": "layout", "evidenceLevel": "HOST", "command": ["scripts/verify-project.sh", "--component", "layout"],
     "description": "Repository layout, contract generator, G1, IPC action, artifact manifest"},
    {"id": "cpp", "evidenceLevel": "HOST", "command": ["scripts/verify-project.sh", "--component", "cpp", "--profile", "full"],
     "description": "C++ Release, MODBUS+BACNET+HMI ON, build + full ctest"},
    {"id": "go", "evidenceLevel": "HOST", "command": ["scripts/verify-project.sh", "--component", "go"],
     "description": "go vet + go test ./... -count=1"},
    {"id": "frontend", "evidenceLevel": "HOST", "command": ["scripts/verify-project.sh", "--component", "frontend"],
     "description": "vitest jsdom + lint + build (build có tsc --noEmit)"},
    {"id": "docs", "evidenceLevel": "HOST", "command": ["python3", "scripts/docs_iso_harness.py", "--expect"],
     "description": "Harness hồ sơ ISO: requirement/scenario/risk/decision/link"},
    {"id": "candidate-pin", "evidenceLevel": "HOST", "command": ["python3", "scripts/candidate_pin_check.py"],
     "description": "Authority baseline khớp manifest đã ghim"},
    {"id": "e2e", "evidenceLevel": "HOST", "command": ["scripts/verify-project.sh", "--component", "e2e"],
     "description": "Playwright e2e (trừ spec bị cách ly)"},
    {"id": "firmware", "evidenceLevel": "HOST", "command": ["scripts/verify-project.sh", "--component", "firmware"],
     "description": "Build firmware STM32"},
    {"id": "release-package", "evidenceLevel": "HOST", "command": ["scripts/verify-project.sh", "--component", "release"],
     "description": "Đóng gói release và kiểm checksum"},
    {"id": "github-ci", "evidenceLevel": "CI", "requiresResource": "GitHub Actions account",
     "runbook": "Đẩy RC commit rồi kiểm required checks trên PR", "owner": "T59-701",
     "description": "11 job workflow chạy thật trên RC commit"},
    {"id": "target-soak", "evidenceLevel": "TARGET", "requiresResource": "board Forlinx/Foxlinx",
     "runbook": "docs/03_implementation/47_RST202_TARGET_ACCEPTANCE_RUNBOOK.md", "owner": "T59-702",
     "description": "10-Program fixture, 3 chu kỳ, 24 h, không poll gap >=200 ms"},
    {"id": "physical-io", "evidenceLevel": "HIL", "requiresResource": "board + instrument đo AO/DO",
     "runbook": "docs/03_implementation/28_IO_CALIBRATION_TEST_PLAN.md", "owner": "T59-703",
     "description": "Ghi I/O vật lý cho cả ST và FBD, đo bằng instrument"},
    {"id": "power-retain", "evidenceLevel": "TARGET", "requiresResource": "board + nguồn cắt được",
     "runbook": "docs/03_implementation/47_RST202_TARGET_ACCEPTANCE_RUNBOOK.md", "owner": "T59-704",
     "description": ">=10 lần cắt điện; RETAIN/LKG/enable-intent phục hồi đúng"}
  ],
  "waves": [
    {"wave": "W0", "title": "Contract và migration foundation", "gates": ["layout", "go", "docs", "candidate-pin"]},
    {"wave": "W1", "title": "POU, compiler và artifact v2", "gates": ["layout", "cpp", "go", "docs", "candidate-pin"]},
    {"wave": "W2", "title": "Control Library", "gates": ["layout", "cpp", "go", "frontend", "docs", "candidate-pin"]},
    {"wave": "W3", "title": "Multi-Program Project, Check và Mapping", "gates": ["layout", "cpp", "go", "frontend", "docs", "candidate-pin"]},
    {"wave": "W4", "title": "Runtime, scheduler, signal, enable và output", "gates": ["layout", "cpp", "go", "docs", "candidate-pin"]},
    {"wave": "W5", "title": "Lifecycle atomic và sản phẩm FE-BE-Core", "gates": ["layout", "cpp", "go", "frontend", "e2e", "docs", "candidate-pin"]},
    {"wave": "W6", "title": "Hardening, packaging và Release Candidate", "gates": ["layout", "cpp", "go", "frontend", "e2e", "firmware", "release-package", "docs", "candidate-pin"]},
    {"wave": "W7", "title": "Target/HIL/V&V và quyết định phát hành", "gates": ["layout", "cpp", "go", "frontend", "e2e", "firmware", "release-package", "docs", "candidate-pin", "github-ci", "target-soak", "physical-io", "power-retain"]}
  ]
}
